{
  "id": "lineage:example",
  "simple_name": "example",
  "name": "example name",
  "size": "Small",
  "speed": 0,
  "ability_modifiers": {
    "strength": 1,
    "dexterity": 1,
    "constitution": 1,
    "intelligence": 1,
    "wisdom": 1,
    "charisma": 1,
    "other": 0
  },
  "languages": [
    "example languages"
  ],
  "traits": [
    {
      "name": "example name",
      "text": "example text",
      "references_table": "example references_table",
      "references_spells": [
        "example references_spells"
      ]
    }
  ],
  "extraction_metadata": {
    "source_pages": [
      1
    ],
    "section": "example section",
    "extraction_date": "2026-01-01",
    "extraction_notes": "example extraction_notes"
  },
  "aliases": [
    "example aliases"
  ],
  "parent_lineage": "lineage:example",
  "ability_modifier_note": "example ability_modifier_note",
  "age": "example age",
  "alignment": "example alignment",
  "size_description": "example size_description",
  "subraces": [
    {
      "name": "example name",
      "simple_name": "example",
      "ability_modifiers": {
        "strength": 1,
        "dexterity": 1,
        "constitution": 1,
        "intelligence": 1,
        "wisdom": 1,
        "charisma": 1
      },
      "traits": [
        {
          "name": "example name",
          "text": "example text",
          "references_table": "example references_table",
          "references_spells": [
            "example references_spells"
          ]
        }
      ]
    }
  ],
  "tables_referenced": [
    "table:example"
  ]
}
